{
  "min_separation": 0.5,
  "hangar": {
    "positions": [
      "P1",
      "P2",
      "P3",
      "P4",
      "P5"
    ],
    "blocking_arcs": [
      {
        "front": "P3",
        "rear": "P4"
      },
      {
        "front": "P3",
        "rear": "P5"
      },
      {
        "front": "P4",
        "rear": "P5"
      }
    ]
  },
  "aircrafts": [
    {
      "id": "R1",
      "client": "C4",
      "earliest_start": 15,
      "target_finish": 67
    },
    {
      "id": "R2",
      "client": "C6",
      "earliest_start": 22,
      "target_finish": 52
    },
    {
      "id": "R3",
      "client": "C3",
      "earliest_start": 30,
      "target_finish": 59
    },
    {
      "id": "R4",
      "client": "C6",
      "earliest_start": 24,
      "target_finish": 62
    },
    {
      "id": "R5",
      "client": "C3",
      "earliest_start": 23,
      "target_finish": 58
    },
    {
      "id": "R6",
      "client": "C6",
      "earliest_start": 16,
      "target_finish": 50
    },
    {
      "id": "R7",
      "client": "C4",
      "earliest_start": 5,
      "target_finish": 41
    },
    {
      "id": "R8",
      "client": "C6",
      "earliest_start": 9,
      "target_finish": 48
    },
    {
      "id": "R9",
      "client": "C5",
      "earliest_start": 7,
      "target_finish": 42
    },
    {
      "id": "R10",
      "client": "C6",
      "earliest_start": 12,
      "target_finish": 51
    },
    {
      "id": "R11",
      "client": "C1",
      "earliest_start": 30,
      "target_finish": 62
    },
    {
      "id": "R12",
      "client": "C4",
      "earliest_start": 11,
      "target_finish": 45
    },
    {
      "id": "R13",
      "client": "C3",
      "earliest_start": 10,
      "target_finish": 44
    },
    {
      "id": "R14",
      "client": "C6",
      "earliest_start": 3,
      "target_finish": 32
    },
    {
      "id": "R15",
      "client": "C1",
      "earliest_start": 25,
      "target_finish": 62
    },
    {
      "id": "R16",
      "client": "C2",
      "earliest_start": 9,
      "target_finish": 43
    },
    {
      "id": "R17",
      "client": "C4",
      "earliest_start": 13,
      "target_finish": 47
    },
    {
      "id": "R18",
      "client": "C5",
      "earliest_start": 32,
      "target_finish": 63
    },
    {
      "id": "R19",
      "client": "C6",
      "earliest_start": 16,
      "target_finish": 47
    },
    {
      "id": "R20",
      "client": "C1",
      "earliest_start": 1,
      "target_finish": 40
    },
    {
      "id": "R21",
      "client": "C3",
      "earliest_start": 29,
      "target_finish": 57
    },
    {
      "id": "R22",
      "client": "C4",
      "earliest_start": 18,
      "target_finish": 49
    },
    {
      "id": "R23",
      "client": "C4",
      "earliest_start": 3,
      "target_finish": 41
    },
    {
      "id": "R24",
      "client": "C1",
      "earliest_start": 25,
      "target_finish": 54
    },
    {
      "id": "R25",
      "client": "C2",
      "earliest_start": 28,
      "target_finish": 62
    },
    {
      "id": "R26",
      "client": "C3",
      "earliest_start": 27,
      "target_finish": 61
    },
    {
      "id": "R27",
      "client": "C1",
      "earliest_start": 17,
      "target_finish": 61
    },
    {
      "id": "R28",
      "client": "C1",
      "earliest_start": 11,
      "target_finish": 56
    },
    {
      "id": "R29",
      "client": "C3",
      "earliest_start": 16,
      "target_finish": 64
    },
    {
      "id": "R30",
      "client": "C6",
      "earliest_start": 28,
      "target_finish": 63
    }
  ],
  "jobs": [
    {
      "id": "J1-1",
      "aircraft_id": "R1",
      "duration": 8,
      "is_first": true,
      "is_last": false
    },
    {
      "id": "J1-2",
      "aircraft_id": "R1",
      "duration": 8,
      "is_first": false,
      "is_last": false
    },
    {
      "id": "J1-3",
      "aircraft_id": "R1",
      "duration": 6,
      "is_first": false,
      "is_last": false
    },
    {
      "id": "J1-4",
      "aircraft_id": "R1",
      "duration": 8,
      "is_first": false,
      "is_last": false
    },
    {
      "id": "J1-5",
      "aircraft_id": "R1",
      "duration": 8,
      "is_first": false,
      "is_last": false
    },
    {
      "id": "J1-6",
      "aircraft_id": "R1",
      "duration": 8,
      "is_first": false,
      "is_last": false
    },
    {
      "id": "J1-7",
      "aircraft_id": "R1",
      "duration": 3,
      "is_first": false,
      "is_last": true
    },
    {
      "id": "J2-1",
      "aircraft_id": "R2",
      "duration": 5,
      "is_first": true,
      "is_last": false
    },
    {
      "id": "J2-2",
      "aircraft_id": "R2",
      "duration": 6,
      "is_first": false,
      "is_last": false
    },
    {
      "id": "J2-3",
      "aircraft_id": "R2",
      "duration": 7,
      "is_first": false,
      "is_last": false
    },
    {
      "id": "J2-4",
      "aircraft_id": "R2",
      "duration": 6,
      "is_first": false,
      "is_last": false
    },
    {
      "id": "J2-5",
      "aircraft_id": "R2",
      "duration": 4,
      "is_first": false,
      "is_last": true
    },
    {
      "id": "J3-1",
      "aircraft_id": "R3",
      "duration": 6,
      "is_first": true,
      "is_last": false
    },
    {
      "id": "J3-2",
      "aircraft_id": "R3",
      "duration": 5,
      "is_first": false,
      "is_last": false
    },
    {
      "id": "J3-3",
      "aircraft_id": "R3",
      "duration": 8,
      "is_first": false,
      "is_last": false
    },
    {
      "id": "J3-4",
      "aircraft_id": "R3",
      "duration": 3,
      "is_first": false,
      "is_last": false
    },
    {
      "id": "J3-5",
      "aircraft_id": "R3",
      "duration": 5,
      "is_first": false,
      "is_last": true
    },
    {
      "id": "J4-1",
      "aircraft_id": "R4",
      "duration": 7,
      "is_first": true,
      "is_last": false
    },
    {
      "id": "J4-2",
      "aircraft_id": "R4",
      "duration": 8,
      "is_first": false,
      "is_last": false
    },
    {
      "id": "J4-3",
      "aircraft_id": "R4",
      "duration": 8,
      "is_first": false,
      "is_last": false
    },
    {
      "id": "J4-4",
      "aircraft_id": "R4",
      "duration": 8,
      "is_first": false,
      "is_last": false
    },
    {
      "id": "J4-5",
      "aircraft_id": "R4",
      "duration": 5,
      "is_first": false,
      "is_last": true
    },
    {
      "id": "J5-1",
      "aircraft_id": "R5",
      "duration": 8,
      "is_first": true,
      "is_last": false
    },
    {
      "id": "J5-2",
      "aircraft_id": "R5",
      "duration": 6,
      "is_first": false,
      "is_last": false
    },
    {
      "id": "J5-3",
      "aircraft_id": "R5",
      "duration": 4,
      "is_first": false,
      "is_last": false
    },
    {
      "id": "J5-4",
      "aircraft_id": "R5",
      "duration": 5,
      "is_first": false,
      "is_last": false
    },
    {
      "id": "J5-5",
      "aircraft_id": "R5",
      "duration": 6,
      "is_first": false,
      "is_last": false
    },
    {
      "id": "J5-6",
      "aircraft_id": "R5",
      "duration": 4,
      "is_first": false,
      "is_last": true
    },
    {
      "id": "J6-1",
      "aircraft_id": "R6",
      "duration": 4,
      "is_first": true,
      "is_last": false
    },
    {
      "id": "J6-2",
      "aircraft_id": "R6",
      "duration": 6,
      "is_first": false,
      "is_last": false
    },
    {
      "id": "J6-3",
      "aircraft_id": "R6",
      "duration": 3,
      "is_first": false,
      "is_last": false
    },
    {
      "id": "J6-4",
      "aircraft_id": "R6",
      "duration": 3,
      "is_first": false,
      "is_last": false
    },
    {
      "id": "J6-5",
      "aircraft_id": "R6",
      "duration": 6,
      "is_first": false,
      "is_last": false
    },
    {
      "id": "J6-6",
      "aircraft_id": "R6",
      "duration": 5,
      "is_first": false,
      "is_last": false
    },
    {
      "id": "J6-7",
      "aircraft_id": "R6",
      "duration": 5,
      "is_first": false,
      "is_last": true
    },
    {
      "id": "J7-1",
      "aircraft_id": "R7",
      "duration": 5,
      "is_first": true,
      "is_last": false
    },
    {
      "id": "J7-2",
      "aircraft_id": "R7",
      "duration": 8,
      "is_first": false,
      "is_last": false
    },
    {
      "id": "J7-3",
      "aircraft_id": "R7",
      "duration": 8,
      "is_first": false,
      "is_last": false
    },
    {
      "id": "J7-4",
      "aircraft_id": "R7",
      "duration": 5,
      "is_first": false,
      "is_last": false
    },
    {
      "id": "J7-5",
      "aircraft_id": "R7",
      "duration": 4,
      "is_first": false,
      "is_last": false
    },
    {
      "id": "J7-6",
      "aircraft_id": "R7",
      "duration": 4,
      "is_first": false,
      "is_last": true
    },
    {
      "id": "J8-1",
      "aircraft_id": "R8",
      "duration": 6,
      "is_first": true,
      "is_last": false
    },
    {
      "id": "J8-2",
      "aircraft_id": "R8",
      "duration": 8,
      "is_first": false,
      "is_last": false
    },
    {
      "id": "J8-3",
      "aircraft_id": "R8",
      "duration": 8,
      "is_first": false,
      "is_last": false
    },
    {
      "id": "J8-4",
      "aircraft_id": "R8",
      "duration": 6,
      "is_first": false,
      "is_last": false
    },
    {
      "id": "J8-5",
      "aircraft_id": "R8",
      "duration": 6,
      "is_first": false,
      "is_last": false
    },
    {
      "id": "J8-6",
      "aircraft_id": "R8",
      "duration": 3,
      "is_first": false,
      "is_last": true
    },
    {
      "id": "J9-1",
      "aircraft_id": "R9",
      "duration": 3,
      "is_first": true,
      "is_last": false
    },
    {
      "id": "J9-2",
      "aircraft_id": "R9",
      "duration": 5,
      "is_first": false,
      "is_last": false
    },
    {
      "id": "J9-3",
      "aircraft_id": "R9",
      "duration": 5,